<?xml version="1.0" encoding="UTF-8"?>
<!ELEMENT ruleset (description,exclude-pattern*,rule+)>
<!ATTLIST ruleset name CDATA "">
<!ELEMENT description (#PCDATA)>
<!ELEMENT exclude-pattern (#PCDATA)>
<!ATTLIST exclude-pattern type CDATA "">
<!ELEMENT rule (properties*,severity*)>
<!ATTLIST rule ref CDATA "">
<!ELEMENT properties (property+)>
<!ELEMENT property (#PCDATA)>
<!ATTLIST property name CDATA "">
<!ATTLIST property value CDATA "">
<!ELEMENT severity (#PCDATA)>
